<?xml version="1.0" encoding="UTF-8"?>
<!DOCTYPE model SYSTEM "activitymgr.dtd">
<model>
	<durations>
		<duration>
			<value>25</value>
		</duration>
		<duration>
			<value>50</value>
		</duration>
		<duration>
			<value>75</value>
		</duration>
		<duration>
			<value>100</value>
		</duration>
	</durations>
	<collaborators>
		<collaborator>
			<login>login1</login>
			<first-name>First Name 1</first-name>
			<last-name>Last Name 1</last-name>
		</collaborator>
		<collaborator>
			<login>login2</login>
			<first-name>First Name 2</first-name>
			<last-name>Last Name 2</last-name>
		</collaborator>
	</collaborators>
	<tasks>
		<task>
			<path>/TASK1</path>
			<name>My task1</name>
		</task>
		<task>
			<path>/TASK2</path>
			<name>My task2</name>
		</task>
	</tasks>
	<contributions>
		<contribution year="2006" month="01" day="01" duration="100">
			<contributor-ref>login1</contributor-ref>
			<task-ref>/TASK1</task-ref>
		</contribution>
		<contribution year="2006" month="01" day="01" duration="75">
			<contributor-ref>login2</contributor-ref>
			<task-ref>/TASK2</task-ref>
		</contribution>
	</contributions>
</model>
